OG0019914 ,Encodes glutathione transferase belonging to the tau class of GSTs. Naming convention according to Wagner et al. (2002).

OG0020530 ,encodes an oligosaccharyl transferase involved response to high salt. Mutants are hypersensitive to high salt conditions The mRNA is cell-to-cell mobile.

OG0020899 ,Calcium-binding EF hand family protein;(source:Araport11)

OG0021828 ,Chloroplast encoded NADH dehydrogenase unit.

OG0022116 ,Receptor regulated by TRXh5; essential in the modulation of spider mite Tetranychus urticae defence.

OG0022119 ,encodes a protein similar to cellulose synthase

OG0022120 ,encodes a ubiquitin-protein ligase containing a HECT domain. There are six other HECT-domain UPLs in Arabidopsis.

OG0022411 ,Receptor regulated by TRXh5; essential in the modulation of spider mite Tetranychus urticae defence.

OG0022454 ,ubiquitin protein ligase 6;(source:Araport11)

OG0022465 ,putative beta-galactosidase

OG0022527 ,Encodes a cysteine-rich receptor-like protein kinase.

OG0022684 ,Cysteine-rich protein that confers cadmium tolerance to yeast. Homologs are also found in rice                                                                                ,Brassica rapa and pine.

OG0022712 ,Encodes a protein that is predicted to act as a phosphatidylinositol-3P 5-kinase                                                                                              ,but                                                                                                                    ,because it lacks a FYVE domain                                                   ,it is unlikely to be efficiently targeted to membranes containing the porposed phosphatidylinositol-3P substrate. Therefore ,its molecular function remains unknown. The mRNA is cell-to-cell mobile.

OG0022713 ,Pectin lyase-like superfamily protein;(source:Araport11)

OG0022857 ,Encodes a protein containing a CRM domain that is involved in group I and group II intron splicing.

OG0022875 ,Ubiquitin-conjugating enzyme family protein;(source:Araport11)

OG0022923 ,Encodes a member of the phosphate starvation-inducJLKJLKJ;JKJ;JLKJFDA S;lacksed glycerol-3-phosphate permease gene family: AT3G47420(G3Pp1)                                                              ,AT4G25220(G3Pp2)                                                                                                       ,AT1G30560(G3Pp3)                                                                 ,AT4G17550(G3Pp4) and AT2G13100(G3Pp5).

OG0022982 ,RTPFRVRPSLSRPLCLSSAFWDGTKKLSLGRHYSAFVGEKLRDHSESYHPVARCGLSRPRTPFRVRPSLSRPLCLSSAFWDGTKKPSLGVTLRLLWARNFEITQNRTTQ

OG0022989 ,Encodes GMI1                                                                                                                                                                  ,a structural-maintenance-of-chromosomes-hinge domain-containing protein. Involved in somatic homologous recombination.

OG0022992 ,The At2g36790 gene encodes a UDP-glucose:flavonol-3-O-glycoside-7-O-glucosyltransferase (UGT73C6)attaching a glucosyl residue to the 7-O-position of the flavonols kaempferol ,quercetin and their 3-O-glycoside derivatives.

OG0023029 ,Encodes HDA14                                                                                                                                                                 ,a member of the histone deacetylase family proteins that can deacetylate a-tubulin                                     ,associates with a/b-tubulin and is retained on GTP/taxol-stabilized microtubules ,at least in part                                                                                                            ,by direct association with the PP2A-A2 subunit. The association of a histone deacetylase with PP2A suggests a direct link between protein phosphorylation and acetylation. Class II RPD3-like family HDAC member which controls negative responses to salinity stress.

OG0023040 ,SAUR-like auxin-responsive protein family;(source:Araport11)

OG0023059 ,glycine/proline-rich protein;(source:Araport11)

OG0023067 ,Encodes a putative sphingosine kinase (SphK) containing the five conserved domains (C1-C5) previously identified in SphKs.
